question,options,answer,knowledge_points
"24) The ""core"" inflation rate is typically defined as the change in consumer prices for all goods included in the CPI basket except energy and food products. Suppose the overall inflation rate based on the CPI was 4 percent for the past year, and energy and food prices did not change during the year. Is the core inflation rate for the past year higher or lower than 4 percent?",Higher|Lower|They are the same|We do not have enough information to answer this question Diff: 2 Section: 1.3,A,
"25) We can approximate the real return on an investment by subtracting the inflation rate from the nominal return on the investment. For example, an investment that returns 10% per year while inflation is 4% per year has a real (inflation adjusted) return of approximately 6%. Which of the following outcomes is NOT possible?","Nominal and real returns are positive|Nominal return is positive, real return is negative|Nominal return is negative, real return is positive|all of these outcomes are possible Diff: 2 Section: 1.3",D,
1) Which of the following is NOT an example of ways in which microeconomic analysis can help Toyota Motor Corporation its in corporate decision making?,Forecasting demand for new automobiles|Determining how many automobiles to produce in order to maximize profits|Predicting how competitors will react to the firm's pricing strategy|Forecasting the effect of Toyota's hiring patterns on the U.S. unemployment rate E) Forecasting the effect of an oil price increase on demand for hybrid autos Diff: 1 Section: 1.4,D,
2) Which of the following is NOT an example of a way in which microeconomic analysis can help in designing environmental policy?,Determining the optimal level of vehicle fuel efficiency standards|Designing laws to provide incentives for firms to implement clean technologies in new vehicles|Lobbying consumers and firms to reduce consumption of energy|Examining the tradeoffs between ecological benefits of environmental legislation and its impacts on consumers' standard of living Diff: 1 Section: 1.4,C,
"3) To evaluate the potential impact of changes to its SUV business, Ford Motor Company would use:",normative economic analysis.|positive economic analysis.|negative economic analysis.|arbitrage analysis. Diff: 1 Section: 1.4,B,
4) The Clean Air Act is designed to restrict automobile emissions and reduce the external costs of air pollution. The economic analysis used to develop the Clean Air Act was:,normative.|positive.|macroeconomic.|none of the above Diff: 1 Section: 1.4,A,
"5) To evaluate the potential impact of introducing the hybrid Prius auto into the U.S. market, Toyota Motor Corporation would use:",positive economic analysis.|normative economic analysis.|negative economic analysis.|forensic analysis. Diff: 1 Section: 1.4,A,
6) The Corporate Average Fuel Economy (CAFE) standards are designed to improve the average fuel economy of cars and light trucks sold in the U.S. The economic analysis used to develop the CAFE standards was:,macroeconomic.|positive.|normative.|none of the above Diff: 1 Section: 1.4,C,
