type,stem,options,answer,knowledge,analysis,level
选择,The price to attend a NBA basketball game in Chicago is \)55 while the CPI in Chicago is 153. The CPI in Charlotte is 108 while the price to attend a NBA basketball game is \(52. Which city offers a smaller real cost of attending a NBA basketball game?,"A. Chicago
B. Charlotte
C. Both are equal
D. Cannot be determined",A,"Real cost comparison across locations, Regional CPI differences",,研究生
选择,"Suppose we expect consumer prices to increase by about 30 percent between 2010 and 2020, and the minimum wage was \)7.25 per hour in 2010. What should be the minimum wage in 2020 if it is set to maintain the same purchasing power as in 2010?","A. \(7.25
B. \)7.55
C. \(9.42
D. none of the above.",B,"Maintaining purchasing power, Inflation adjustment of wages",,研究生
选择,"The ""core"" inflation rate is typically defined as the change in consumer prices for all goods included in the CPI basket except energy and food products. Suppose the overall inflation rate based on the CPI was 4 percent for the past year, and energy and food prices did not change during the year. Is the core inflation rate for the past year higher or lower than 4 percent?","A. Higher
B. Lower
C. They are the same
D. We do not have enough information to answer this question.",A,"Core vs. overall inflation, CPI components",,研究生
选择,"We can approximate the real return on an investment by subtracting the inflation rate from the nominal return on the investment. For example, an investment that returns 10% per year while inflation is 4% per year has a real (inflation adjusted) return of approximately 6%. Which of the following outcomes is NOT possible?","A. Nominal and real returns are positive
B. Nominal return is positive, real return is negative
C. Nominal return is negative, real return is positive
D. all of these outcomes are possible",D,"Real vs. nominal returns, Fisher equation approximation",,研究生
选择,Which of the following is NOT an example of ways in which microeconomic analysis can help Toyota Motor Corporation in its corporate decision making?,"A. Forecasting demand for new automobiles
B. Determining how many automobiles to produce in order to maximize profits
C. Predicting how competitors will react to the firm's pricing strategy
D. Forecasting the effect of Toyota's hiring patterns on the U.S. unemployment rate
E. Forecasting the effect of an oil price increase on demand for hybrid autos",D,"Scope of microeconomics, Firm-level vs. macro-level analysis",,研究生
选择,Which of the following is NOT an example of a way in which microeconomic analysis can help in designing environmental policy?,"A. Determining the optimal level of vehicle fuel efficiency standards
B. Designing laws to provide incentives for firms to implement clean technologies in new vehicles
C. Lobbying consumers and firms to reduce consumption of energy
D. Examining the tradeoffs between ecological benefits of environmental legislation and its impacts on consumers' standard of living",C,"Microeconomics in policy design, Incentives vs. lobbying",,研究生
选择,"To evaluate the potential impact of changes to its SUV business, Ford Motor Company would use:","A. normative economic analysis.
B. positive economic analysis.
C. macroeconomic analysis.
D. consumer sentiment analysis.",A,"Normative vs. positive economics, Corporate decision frameworks",,研究生
选择,Designing laws to provide incentives for firms to implement clean technologies in new vehicles,"A. Designing laws to provide incentives for firms to implement clean technologies in new vehicles
B. Lobbying consumers and firms to reduce consumption of energy
C. Examining the tradeoffs between ecological benefits of environmental legislation and its impacts on consumers' standard of living",B,"Environmental policy instruments, Incentive-based regulation, Energy conservation strategies",,研究生
选择,The Clean Air Act is designed to restrict automobile emissions and reduce the external costs of air pollution. The economic analysis used to develop the Clean Air Act was:,"A. normative.
B. positive.
C. macroeconomic.
D. none of the above",A,"Environmental regulation, Externalities, Normative economic analysis",,研究生
选择,"To evaluate the potential impact of introducing the hybrid Prius auto into the U.S. market, Toyota Motor Corporation would use:","A. positive economic analysis.
B. normative economic analysis.
C. negative economic analysis.
D. forensic analysis.",A,"Product launch analysis, Positive economic analysis, Market impact assessment",,研究生
选择,The Corporate Average Fuel Economy (CAFE) standards are designed to improve the average fuel economy of cars and light trucks sold in the U.S. The economic analysis used to develop the CAFE standards was:,"A. macroeconomic.
B. positive.
C. normative.
D. none of the above",C,"CAFE standards, Fuel economy policy, Normative economic analysis",,研究生
